{
  "context": "EsDashboard is an internet-facing web application that provides an Elasticsearch-based dashboard for monitoring and visualizing Checkov security compliance failures within Azure DevOps (ADO) pipelines. The system serves Singapore region with Level 2 business criticality, enabling DevOps teams to track, analyze, and remediate infrastructure security violations detected during CI/CD processes.",
  "userStories": [
    {
      "id": "US-1",
      "title": "View Checkov Failure Dashboard",
      "asA": "DevOps Engineer",
      "iWantTo": "view a comprehensive dashboard showing all Checkov failures across ADO pipelines",
      "soThat": "I can quickly identify and prioritize security compliance issues in our infrastructure deployments",
      "storyPoints": 8,
      "priority": "High",
      "tags": ["Frontend", "Dashboard", "Security", "Elasticsearch"],
      "relatedUserStories": [],
      "epic": "Security Monitoring Dashboard",
      "acceptanceCriteria": [
        {
          "id": "AC-1",
          "given": "I am an authenticated DevOps Engineer",
          "when": "I access the EsDashboard main page",
          "then": "I should see a dashboard with Checkov failure metrics, charts, and recent alerts"
        },
        {
          "id": "AC-2",
          "given": "There are Checkov failures in the last 24 hours",
          "when": "I view the dashboard",
          "then": "I should see real-time failure counts, severity distribution, and affected pipelines"
        },
        {
          "id": "AC-3",
          "given": "I am viewing the dashboard",
          "when": "I click on a failure metric",
          "then": "I should be able to drill down to see detailed failure information"
        }
      ]
    },
    {
      "id": "US-2",
      "title": "Filter and Search Failures",
      "asA": "Security Analyst",
      "iWantTo": "filter and search Checkov failures by pipeline, severity, time range, and failure type",
      "soThat": "I can focus on specific security issues that require immediate attention",
      "storyPoints": 5,
      "priority": "High",
      "tags": ["Frontend", "Search", "Filtering", "Security"],
      "relatedUserStories": ["US-1"],
      "epic": "Security Monitoring Dashboard",
      "acceptanceCriteria": [
        {
          "id": "AC-4",
          "given": "I am viewing the failures list",
          "when": "I apply filters for severity level 'High' and time range 'Last 7 days'",
          "then": "I should see only high-severity failures from the past week"
        },
        {
          "id": "AC-5",
          "given": "I am on the search interface",
          "when": "I search for a specific pipeline name or failure type",
          "then": "I should get filtered results matching my search criteria"
        }
      ]
    },
    {
      "id": "US-3",
      "title": "View Detailed Failure Information",
      "asA": "DevOps Engineer",
      "iWantTo": "view detailed information about specific Checkov failures including code location, rule violated, and remediation suggestions",
      "soThat": "I can understand the issue and fix it efficiently",
      "storyPoints": 3,
      "priority": "Medium",
      "tags": ["Frontend", "Details", "Security"],
      "relatedUserStories": ["US-1", "US-2"],
      "epic": "Security Monitoring Dashboard",
      "acceptanceCriteria": [
        {
          "id": "AC-6",
          "given": "I click on a specific Checkov failure",
          "when": "the detail view opens",
          "then": "I should see the violated security rule, affected code snippet, severity level, and recommended fix"
        },
        {
          "id": "AC-7",
          "given": "I am viewing failure details",
          "when": "I look at the remediation section",
          "then": "I should see actionable steps to resolve the security issue"
        }
      ]
    },
    {
      "id": "US-4",
      "title": "Configure Data Ingestion from ADO",
      "asA": "System Administrator",
      "iWantTo": "configure the system to automatically ingest Checkov failure data from ADO pipelines",
      "soThat": "the dashboard displays up-to-date failure information without manual intervention",
      "storyPoints": 13,
      "priority": "Critical",
      "tags": ["Backend", "Integration", "ADO", "API"],
      "relatedUserStories": [],
      "epic": "Data Integration",
      "acceptanceCriteria": [
        {
          "id": "AC-8",
          "given": "I have ADO pipeline credentials and endpoints",
          "when": "I configure the data ingestion settings",
          "then": "the system should automatically fetch Checkov failure data every 15 minutes"
        },
        {
          "id": "AC-9",
          "given": "A new Checkov failure occurs in an ADO pipeline",
          "when": "the ingestion process runs",
          "then": "the failure should appear in the dashboard within 15 minutes"
        },
        {
          "id": "AC-10",
          "given": "The ADO service is temporarily unavailable",
          "when": "the ingestion process encounters an error",
          "then": "the system should retry and log the failure for monitoring"
        }
      ]
    },
    {
      "id": "US-5",
      "title": "Set Up Alerting and Notifications",
      "asA": "Security Manager",
      "iWantTo": "configure alerts for critical Checkov failures and receive notifications",
      "soThat": "I can respond quickly to high-severity security issues",
      "storyPoints": 8,
      "priority": "Medium",
      "tags": ["Backend", "Notifications", "Alerting", "Security"],
      "relatedUserStories": ["US-4"],
      "epic": "Alerting System",
      "acceptanceCriteria": [
        {
          "id": "AC-11",
          "given": "I am configuring alert rules",
          "when": "I set up a rule for critical severity failures",
          "then": "I should receive email notifications when critical failures occur"
        },
        {
          "id": "AC-12",
          "given": "A critical Checkov failure is detected",
          "when": "the alert condition is met",
          "then": "relevant team members should receive notifications within 5 minutes"
        }
      ]
    }
  ],
  "functionalRequirements": [
    {
      "id": "FR-1",
      "title": "Dashboard Visualization System",
      "description": "The system must provide a web-based dashboard that displays Checkov failure metrics in real-time using charts, graphs, and tabular data visualization.",
      "relatedUserStories": ["US-1"],
      "inputs": "Elasticsearch data containing Checkov failure records",
      "triggers": "User accessing dashboard, automatic data refresh",
      "mainFlow": "Fetch data from Elasticsearch, process metrics, render visualizations",
      "outputs": "Interactive dashboard with charts, metrics, and failure lists"
    },
    {
      "id": "FR-2",
      "title": "Advanced Search and Filtering",
      "description": "The system must provide comprehensive search and filtering capabilities allowing users to query Checkov failures by multiple criteria including pipeline, severity, time range, and failure type.",
      "relatedUserStories": ["US-2"],
      "inputs": "User search queries and filter parameters",
      "triggers": "User initiating search or applying filters",
      "mainFlow": "Parse search query, build Elasticsearch query, execute search, return filtered results",
      "outputs": "Filtered list of Checkov failures matching search criteria"
    },
    {
      "id": "FR-3",
      "title": "Failure Detail Viewer",
      "description": "The system must display detailed information for individual Checkov failures including rule violations, code context, severity assessment, and remediation guidance.",
      "relatedUserStories": ["US-3"],
      "inputs": "Failure ID or record identifier",
      "triggers": "User clicking on specific failure entry",
      "mainFlow": "Retrieve failure details from Elasticsearch, format data, display comprehensive view",
      "outputs": "Detailed failure view with code snippets, rules, and remediation steps"
    },
    {
      "id": "FR-4",
      "title": "ADO Pipeline Integration",
      "description": "The system must automatically ingest Checkov failure data from Azure DevOps pipelines through REST API integration with configurable polling intervals.",
      "relatedUserStories": ["US-4"],
      "inputs": "ADO API endpoints, authentication credentials, pipeline identifiers",
      "triggers": "Scheduled polling, webhook notifications from ADO",
      "mainFlow": "Authenticate with ADO, fetch pipeline data, extract Checkov results, transform and store in Elasticsearch",
      "outputs": "Checkov failure data stored in Elasticsearch with proper indexing"
    },
    {
      "id": "FR-5",
      "title": "Alert and Notification System",
      "description": "The system must provide configurable alerting for critical Checkov failures with multiple notification channels including email and integration with external monitoring systems.",
      "relatedUserStories": ["US-5"],
      "inputs": "Alert rules configuration, failure severity thresholds, notification preferences",
      "triggers": "Critical failures detected, threshold violations",
      "mainFlow": "Evaluate failure against alert rules, trigger notifications, log alert history",
      "outputs": "Email notifications, webhook calls, alert logs"
    }
  ],
  "errorAndEdgeCases": [
    "ADO API rate limiting and quota exhaustion",
    "Elasticsearch cluster unavailability or performance degradation",
    "Network timeouts during ADO data ingestion",
    "Invalid or malformed Checkov failure data from ADO",
    "Authentication failures with ADO services",
    "Dashboard timeout with large datasets (>10k failures)",
    "Concurrent user access causing resource contention",
    "Missing or incomplete Checkov scan results",
    "Duplicate failure records from multiple pipeline runs",